{
  "schemaVersion": 1,
  "id": "com.opendesk.example.basic",
  "version": "0.1.0",
  "name": "OpenDesk App Mode Example",
  "runtime": {
    "minVersion": "0.1.0"
  },
  "entry": "main.js",
  "singleInstance": true,
  "window": {
    "mainId": "main",
    "closeBehavior": "hide"
  },
  "tray": {
    "enabled": true,
    "icons": {
      "windows": "assets/tray.ico",
      "macos": "assets/tray-template.png"
    },
    "tooltip": "OpenDesk App Mode Example",
    "primaryAction": "opendesk.open",
    "menuMode": "merge",
    "menu": [
      { "id": "sample.run", "label": "Run sample action", "action": "sample.run" },
      { "type": "separator" },
      { "id": "sample.status", "label": "Status: ready", "enabled": false }
    ]
  }
}
