{
  "schemaVersion": 1,
  "id": "com.opendesk.desktop",
  "name": "OpenDesk",
  "version": "0.1.0",
  "entry": "main.js",
  "singleInstance": true,
  "window": {
    "mainId": "main",
    "closeBehavior": "hide"
  },
  "tray": {
    "enabled": true,
    "tooltip": "OpenDesk",
    "primaryAction": "opendesk.open",
    "icons": {
      "windows": "assets/tray.ico",
      "macos": "assets/opendesk-logo.png"
    },
    "menu": [
      {
        "id": "open-scheduler-center",
        "label": "计划中心",
        "action": "scheduler.center"
      },
      {
        "id": "new-schedule",
        "label": "新建计划…",
        "action": "scheduler.new"
      },
      {
        "type": "separator"
      },
      {
        "id": "open-permissions",
        "label": "权限管理…",
        "action": "permissions.open"
      },
      {
        "id": "open-runtime-log",
        "label": "运行日志…",
        "action": "runtime.log"
      },
      {
        "type": "separator"
      },
      {
        "id": "open-examples",
        "label": "示例代码…",
        "action": "opendesk.examples"
      }
    ]
  }
}
